{
  "id": "5f0dca00-0000-4000-8000-000000000521",
  "schemaVersion": 1,
  "name": "Wren (2024 fixture)",
  "rulesFamily": "srd-5.2.1",
  "baseAbilities": { "str": 10, "dex": 14, "con": 12, "int": 10, "wis": 13, "cha": 8 },
  "pins": [
    { "contentId": "5f0dc000-0000-4000-8000-000000000002", "revisionId": "5f0de000-0000-4000-8000-000000000002" },
    { "contentId": "5f0dc000-0000-4000-8000-000000000003", "revisionId": "5f0de000-0000-4000-8000-000000000003" },
    { "contentId": "5f0dc000-0000-4000-8000-000000000005", "revisionId": "5f0de000-0000-4000-8000-000000000005" },
    { "contentId": "5f0dc000-0000-4000-8000-000000000006", "revisionId": "5f0de000-0000-4000-8000-000000000006" }
  ],
  "overrides": [],
  "updatedAt": "2026-09-24T00:00:00+00:00"
}
